,Headlines
0,"Punjab: Heels dug in, Captain Amarinder Singh vs Navjot Singh Sidhu row may snowball into bigger storm"
1,"Amid leadership change buzz, Yediyurappa asks supporters not to indulge in protests that may embarrass BJP"
2,"CAA, NRC nothing to do with Hindu-Muslim divide: RSS chief"
3,How Yediyurappa is an exception to BJP rule
4,"Congress, Left that oppose BJP nationally shouldn't fight TMC in West Bengal: Partha Chatterjee"
5,Yeddyurappa may call MLAs' meet on July 26
6,"'We are not political tourists', Priyanka Gandhi hits back at BJP"
7,"Sonia Gandhi sets up parliament groups, Adhir Ranjan Chowdhury to stay as floor leader"
8,Sharad Pawar is 'remote control' of MVA govt: Maharashtra Congress chief
9,Is Prashant Kishor planning a new innings with the Congress?
10,BJP may move court against appointment of Mukul Roy as West Bengal house panel chief
11,BJP MLAs quit panels in protest as Mukul Roy gets PAC chief’s post
12,Will he agree to lead Congress in Lok Sabha? All eyes on Rahul Gandhi
13,"Navjot Sidhu’s AAP tweet stokes buzz, Prashant Kishor meets Rahul Gandhi"
14,VHP suggests deletion of one-child norm in draft UP population policy
15,Congress rallies opposition against ministry of cooperation
16,"Rahul, Priyanka slam BJP govt in UP over poll violence"
17,"With Uttar Pradesh polls in mind, BJP makes OBC-dalit outreach"
18,Cabinet reshuffle: Why PM Modi dropped these top 7 ministers
19,PM Modi expands his Cabinet: Full list of new Union ministers
20,"Congress offers olive branch to G23, to let netas retain key posts"
21,"No law and order in Bengal, violence at peak, says Dilip Ghosh"
22,Rahul Gandhi attacks govt on Rafale deal
23,Spotlight on Mamata Banerjee after Tirath Rawat resigns as Uttarakhand CM
24,'Remove solicitor general': TMC MPs petition PM Modi; law officer denies meeting BJP's Suvendu Adhikari
25,Trinamool Congress questions Bengal governor's silence over 'corruption' charges
26,Assam anti-CAA stir: Akhil Gogoi walks free as special NIA court clears him of all charges
27,"Educated unemployed people hold BJP, Cong govts responsible for their plight: Mayawati"
28,'Unfortunate': West Bengal governor responds to speaker's charge of 'interference'
29,"Amid infighting in Punjab Congress,  Navjot Sidhu meets Priyanka Gandhi"
30,2022 UP elections: Is opposition making BJP's task easier?
31,Shatrughan Sinha says pro-Modi tweet a 'humour'; not leaving Congress
32,Changing Kannada names to Malayalam: Yediyurappa writes to Pinarayi Vijayan; Kerala govt denies any such move
33,Congress not in favour of maintaining tie-up with ISF: Adhir Chowdhury
34,'Corrupt man': Mamata targets Dhankar again; Bengal governor says 'allegations unfortunate'
35,Punjab Congress infighting: Navjot Singh Sidhu to meet Rahul Gandhi on Tuesday
36,"BSP to fight UP, Uttarakhand assembly polls alone, says Mayawati"
37,Top BJP leaders discuss preparations for assembly polls in 5 states in 2022
38,Ram Setu should be declared a national monument: Union culture minister Prahlad Patel
39,Congress culture to 'attack' Indians whenever country accomplishes record: BJP chief Nadda
40,Sharad Pawar makes ‘blink & miss’ appearance at opposition meeting
41,Congress to participate in all-party meeting convened by PM Narendra Modi
42,PoK will merge with India under PM Narendra Modi’s leadership: Tourism minister Prahlad Patel
43,Yediyurappa to form a committee to decide on all major projects undertaken by government
44,Sharad Pawar working to unite opposition: NCP
45,LJP vs LJP: Paras faction announces new national executive; Chirag meets LS Speaker Om Birla
46,"Covid-19 deaths: PM Modi must express regret, says Congress leader"
47,Regional parties can never do good for the state: BJP leader Jitin Prasada
48,"Amid talks of Union Cabinet expansion, Bihar leaders hopeful of getting four more berths"
49,PM Modi failed to stand with people in need of medical help during second Covid wave: Kapil Sibal
50,"""To Blame All Deaths On One Person Not Right"": Health Minister On Covid"
51,"Decision To Change NCERT History Textbooks 'Political', Not 'Academic': Indian History Congress"
52,"""PM Behaved Like Coward"": Priyanka Gandhi Vadra Slams Centre On Covid Crisis"
53,'Disqualify Shashi Tharoor As MP': BJP Colleague Cites Covid Remark
54,"Raj Chakraborty, Trinamool's Celebrity Face Who Wants To Be People's Person"
55,"BR Ambedkar Proposed Sanskrit As ""Official National Language"": Chief Justice Of India SA Bobde"
56,Indian Sikh Pilgrims' Schedule Affected Amid Violence In Pakistan
57,Prince Philip In Quotes - Including To British Indian Businessman
58,Muslim League Worker Killed As Kerala Reports Post-Poll Violence
59,"""One Reason Is..."": Indian-American On Running For Virginia Lt Governor"
60,AIADMK Candidate Makes Parottas While Campaigning For Tamil Nadu Polls
61,"In Major Setback To Asaduddin Owaisi, Party's Bengal In-Charge Quits Ahead Of Polls"
62,Want To Finish Seat Sharing With Left Soon: Congress's Adhir Chowdhury
63,"Left-Congress Flex Massive Crowd At Kolkata Rally, Slam Trinamool, BJP"
64,"In Government Vs Twitter, Made-In-India Koo Gains 900,000 Users In 5 Days"
65,"""To Blame All Deaths On One Person Not Right"": Health Minister On Covid"
66,"Decision To Change NCERT History Textbooks 'Political', Not 'Academic': Indian History Congress"
67,"""PM Behaved Like Coward"": Priyanka Gandhi Vadra Slams Centre On Covid Crisis"
68,'Disqualify Shashi Tharoor As MP': BJP Colleague Cites Covid Remark
69,"Raj Chakraborty, Trinamool's Celebrity Face Who Wants To Be People's Person"
70,"BR Ambedkar Proposed Sanskrit As ""Official National Language"": Chief Justice Of India SA Bobde"
71,Indian Sikh Pilgrims' Schedule Affected Amid Violence In Pakistan
72,Prince Philip In Quotes - Including To British Indian Businessman
73,Muslim League Worker Killed As Kerala Reports Post-Poll Violence
74,"""One Reason Is..."": Indian-American On Running For Virginia Lt Governor"
75,AIADMK Candidate Makes Parottas While Campaigning For Tamil Nadu Polls
76,"In Major Setback To Asaduddin Owaisi, Party's Bengal In-Charge Quits Ahead Of Polls"
77,Want To Finish Seat Sharing With Left Soon: Congress's Adhir Chowdhury
78,"Left-Congress Flex Massive Crowd At Kolkata Rally, Slam Trinamool, BJP"
79,"In Government Vs Twitter, Made-In-India Koo Gains 900,000 Users In 5 Days"
80,"
Piyush Goyal appointed Leader of House in Rajya Sabha; Union minister succeeds Thaawarchand Gehlot
"
81,"
Suvendu Adhikari meets West Bengal governor over Mukul Roy’s appointment as PAC chief
"
82,"
Ready to vacate post if Congress-high command asks me, says Chhattisgarh CM Bhupesh Baghel
"
83,"
Narendra Modi tips hat to outgoing ministers, tells new joinees to learn from their predecessors' experience
"
84,"
Punjab chief minister Amarinder Singh to attend Navjot Singh Sidhu's coronation ceremony tomorrow
"
85,"
Karnataka: Lingayat pontiffs rally behind BS Yediyurappa, urge BJP to allow him to complete term as CM
"
86,"
'Trying to systematically assault India's prestige': Manohar Lal Khattar slams Congress over Pegasus snooping row
"
87,"
Mamata Banerjee to deliver Martyrs' Day address; virtual event to be screened in Gujarat, UP, Assam, Delhi
"
88,"
Kalyan Singh critical, former Uttar Pradesh chief minister on life support system, says hospital
"
89,"
Congress accuses BJP-led dispensation of misusing Pegasus to being down elected Karnataka government
"
90,"
Navjot Singh Sidhu has not sought time to meet Amarinder Singh, says Punjab CM advisor
"
91,"
Pegasus spyware row shifts Oppn mood towards Adjournment motion, but Parliament has no dearth of motions
"
92,"
BS Yediyurappa hints at exit in Karnataka, says have to abide by high command's decision
"
93,"
Parliament's Monsoon Session: Day 2 sees Oppn disrupt LS over Pegasus row, target Centre in RS on COVID
"
94,"
Parliament Updates: LS, RS adjourned till 22 July; PM's COVID-19 briefing with parties underway
"
95,"
Parliament LATEST Updates: RS, LS adjourned amid Oppn uproar on day 1 of Monsoon Session; both Houses reconvene at 11 am tomorrow
"
96,"
Opposition disrupts Day 1 of Parliament's Monsoon Session as PM introduces newly inducted ministers
"
97,"
Parliament's Monoon Session: Ask sharpest of questions, but allow govt to respond, PM tells Opposition
"
98,"
Parliament's Monsoon Session: From Centre's bills to Oppn's talking points and COVID-19 looming large, here's what to expect
"
99,"
Sonia Gandhi makes Sidhu Punjab Congress chief amid dissent: A look at his political career
"
100,Trump's first 100 days on the global stage
101,Erdogan shuns West with Syria strikes and more mass detentions
102,"German crowd hisses, boos at Ivanka when she defends her dad"
103,"From economic woes to terrorism, a daunting to-do list for France's next president"
104,European democracy is under threat. Who knew? 
105,"Trump dumps Russia, woos China instead"
106,White House considering order to withdraw from NAFTA
107,Trump's global envoy faces tough Turkey visit
108,Theresa May: A British authoritarian?
109,UK's Labour Party vows to ditch Theresa May's Brexit plan if elected
110,UK snap election: What does it mean?
111,Emmanuel Macron: The next surprise president?
112,Can Marine Le Pen actually win?
113,The beginner's guide to the French elections
114,The only language Putin understands on Syria
115,"The 4 Russia investigations in Congress, explained "
116,Russia vetoes UN statement on North Korea's missile tests
117,India wants to seal its borders 
118,Why China won't buy Trump's North Korea bluster
119,The North Korea rhetoric is angry -- but is conflict closer?
120,5 corruption scandals that rocked Israel
121,France 'has proof' Assad regime was behind Syria chemical weapon attack
122,US Defense Secretary Mattis visits Afghanistan
123,Putin building massive Arctic military base
124,Macron is leading a 'democratic revolution' 
125,North Korea: Kim Jong Un supervised launches
126,How much will Brexit cost the UK?
127,"No, Trump: Russian hacking is not like the CIA's WMD fiasco "
128,Why Trump should make North Korea a top priority
129, New Year's resolution: Hold Russia accountable
130,Istanbul attack: Turkey must end blame game and look for solutions
131,The folly of Trump's palace guard
132,Trump team doomed to repeat Bush's mistakes
133,What Trump's Cabinet of 'best people' lacks 
134,Obama must pardon Manning and Snowden before Trump takes office
135,Trump's bromance with Putin will split the West in two
136,"Biden administration targeting rural communities with funding for vaccine education and outreach, beefing up testing"
137,Biden administration preparing sanctions on Cuban regime
138,Daughter of detained man behind 'Hotel Rwanda' says she was spied on by Israeli software
139,House passes legislation to expand Afghan visa program
140,Eighteen states have enacted new laws that make it harder to vote
141,US Capitol rioter who captured Babbitt's death on video is the 20th person to plead guilty in insurrection
142,Hunter Biden to meet with potential art buyers at two shows amid ethics concerns 
143,Bob Dole says he's still 'a Trumper' but 'sort of Trumped out'
144,Pelosi just made an unprecedented move. Here's why
145,Neil Armstrong Fast Facts
146,Vaccine inequality is costing rich countries tens of billions in lost output
147,How Republicans and SCOTUS are shrinking the power of voters of color
148,Pelosi explains why she rejected GOP lawmakers from January 6 committee
149,"As Florida cases surge, DeSantis stays the course on Covid "
150,Pelosi considering adding GOP Rep. Adam Kinzinger to the 1/6 select committee
151,Why 'wokeness' is the biggest threat to Democrats in 2022
152,CNN town hall with President Biden
153,Biden health officials begin discussing mask recommendations as variants surge cases
154,Abby Finkenauer announces Senate bid in Iowa  
155,1998 US Embassies in Africa Bombings Fast Facts
156,"A far-right extremist killed 77 people in Norway. A decade on, 'the hatred is still out there' but attacker's influence is seen as low"
157,Wyden delays key Biden immigration nominee until he gets more info on Portland unrest response
158,'This is way beyond collaborative': Young leaders see their feedback reflected in Biden's plans
159,Biden grappling with immigration and travel restrictions as pandemic worsens
160,Biden predicts restaurants and businesses will be 'in a bind' for some time due to labor shortages
161,Jim McGreevey Fast Facts 
162,Alberto Gonzales Fast Facts
163,"5 things to know for July 22: Covid-19, Capitol riot, guns, wildfires, China"
164,DOJ creates gun trafficking strike forces in five cities to crack down on sources of firearm-related crime
165,More GOP lawmakers embrace vaccine but still aren't calling out misinformation about it
166,Trump and the GOP spin fantasies to hide his crimes against the Constitution
167,These futuristic pods could help cities solve their traffic problems
168,This Syrian man was tortured and murdered. His brother wants justice
169,The door is closing on Chinese tech IPOs on Wall Street
170,Trump shares disappointment with Pence in new audio recording
171,Teenager charged after allegedly changing yearbook to include Hitler quote and Boston Marathon bomber reference
172,Biden slams attempts to curb voting rights but says he isn't ready to call for an end of the filibuster 
173,Trump called crowd gathered for his speech before Capitol riot 'loving' in March audio recording
174,"Biden says he believes kids under 12 will be able to get Covid-19 vaccines 'soon,' but it's up to scientists "
175,5 takeaways from President Joe Biden's CNN town hall 
176,"McConnell says GOP will not vote to raise debt ceiling, setting up clash in Congress"
177,Trump calls crowd during January 6 speech a 'loving crowd'
178,US and Germany reach deal on controversial pipeline that Biden sees as a Russian 'geopolitical project'
179,Watch the entire CNN town hall with President Joe Biden
180,"Biden: The first time they played 'Hail to the Chief' I asked, 'Where is he?'"
181,Myanmar doctors in hiding and hunted by the junta as Covid crisis ravages the country
182,Monthly child tax credit payments may mean a big tax surprise in the spring for some parents
183,Part 3: CNN Presidential Town Hall with Joe Biden 
184,Pelosi exploded the myth of bipartisanship 
185,Don Lemon cracks up at Joe Biden's 'Hail to the Chief' story
186,'I was disappointed': Dr. Wen reacts to Biden's answer on Covid-19 vaccine
187,Part 1: CNN Presidential Town Hall with Joe Biden (July 21) 
188,See moment Biden teases (then praises) Fox News hosts
189,Part 2: CNN Presidential Town Hall with Joe Biden (July 21) 
190,What are the odds Biden can un-stall the rest of his agenda?
191,CNN's Don Lemon presses Joe Biden on his answer on the filibuster
192,Biden warns about conspiracies flourishing in the US: 'The rest of the world's wondering about us'
193,Prosecutors had evidence last year to charge prominent Trump ally Tom Barrack 
194,Biden reveals what world leaders are asking him about America
195,West Virginia's anti-trans sports ban temporarily blocked by federal judge
196,Federal judge temporarily blocks Arkansas' ban on gender-affirming treatment for trans youth
197,Biden to participate in CNN town hall in Cincinnati Wednesday
198,Fact checking Rep. Jordan's claim that Speaker Pelosi was responsible for US Capitol security on January 6
199,"Banks held call with the 1/6 committee chair on Tuesday. By Wednesday, he was off the panel."
200,Judge forces US Capitol rioter to unlock laptop seized by FBI 
201,The White House's Covid-19 transparency problem 
202,5 things to watch during CNN's town hall with Joe Biden
203,Nancy Pelosi just doomed the already tiny chances of the 1/6 committee actually mattering
204,How to watch the Biden CNN town hall 
205,"Republicans block vote on bipartisan infrastructure bill, pushing for more time to write it"
206,"Biden names ambassadors to Canada, Slovenia and Austria"
207,McCarthy pulls his 5 GOP members from 1/6 committee after Pelosi rejects 2 of his picks 
208,Milley pressed on claims he was concerned Trump would attempt coup
209,CNN Reporter: Milley did something he rarely does
210,See what Liz Cheney had to say about McCarthy
211,Rep. McCarthy blasts Pelosi: She has 'broken this institution'
212,Blinken goes back to Sesame Street
213,The latest on the House Capitol riot committee
214,Kerry: 'Why litter the road to space?'
215,11 Trump associates have now been charged with crimes. 11!
216,US extends Covid-19 travel restrictions with Canada and Mexico through August 21
217,Pelosi just made an unprecedented move. Here's why
218,"Ex-Army Ranger weaponized military training to aid Capitol rioters, judge says"
219,Passengers trapped inside submerged subway as China battles deadly floods
220,Ad hoc extremist groups come into focus in post-January 6 criminal charges 
221,House Democrats call for cutting federal funding for charter schools
222,"Water crisis protests reportedly continue in Iran, with chants in capital "
223,"What Marjorie Taylor Greene doesn't know about HIPAA is, well, a lot"
224,House Republicans sharpen plan of attack on Democrats' January 6 probe
225,Kosher grocery stores drop Ben & Jerry's after its decision to stop selling ice cream in Palestinian territories 
226,Trumpland's dangerous role playing games
227,"Ex-Army Ranger weaponized military training during Capitol riot, judge says"
228,In pictures: Pandemic limits Hajj pilgrimage
229,"Ted Cruz is blocking diplomats from being confirmed, and it has nothing to do with their qualifications"
230,See what Ted Cruz is doing to frustrate Republicans and Democrats
231,Biden and Schumer working fast to confirm judges and counter Trump's reshaping of the federal bench
232,"Personal threats, election lies and punishing new laws rattle election officials, raising fears of a mass exodus"
233,"Michael Avenatti, newly sentenced for extortion, faces trial this week for allegedly defrauding clients"
234,Afghan peace negotiator: Our people are suffering
235,"5 things to know for July 21: Covid-19, Congress, Trump ally, opioid trial, Olympics"
236,tokyo-olympicsTokyo Olympics: Indian contingent ready to rumble in 'Games of Hope'
237,tokyo-olympicsDeepika Kumari in focus as India look to exorcise past ghosts
238,tokyo-olympicsIt's show-time for the first 'TV-only' Olympics: Indian medal hopes
239,Indian athletes in Olympics 2021
240,Deepak Chahar
241,IND vs SL 2nd ODI
242,Tokyo Olympics 2021
243,Olympics 2021 Schedule
244,Novak Djokovic knows 'history is on the line' at Tokyo Olympics
245,Tokyo Olympics 2021: Complete India Schedule
246,"Bye for Panghal, 3 others; tough overall draw for Indian boxers at Olympics"
247,"20 Indian athletes, 6 officials to take part in opening ceremony"
248,"Revathi Veeramani: Orphaned at 7, now on world stage in Tokyo"
249,Sajan Prakash: India’s top swimmer ready to compete at Olympics
250,Tokyo 2020: Manu Bhaker aiming to clinch a gold medal
251,"Tokyo 2020: Sindhu, badminton star and India's key contender"
252,"Tokyo 2020: Thrill, excitement begins with stringent Covid rules"
253,"1st ODI: Dhawan, Kishan star as India thrash Sri Lanka"
254,Fans stand in solidarity after Rashford's mural vandalised
255,How English fans painted an ugly picture at Euro 2020 final
256,Italy inflict penalty heartache on England to win Euro 2020 title
257,Djokovic triumphs at Wimbledon to claim 20th Grand Slam title
258,Garlanded Rishabh Pant thanks Ravi Shastri for grand welcome
259,Sri Lanka skipper Dasun Shanaka says on-field bust up was about tactics
260,Bangladesh outclass Zimbabwe in first T20I
261,"Blow for Team India: Sundar joins Avesh, ruled out of England series"
262,'Focus on one lift at a time': Karnam's advice for Mirabai in Tokyo
263,Judoka Sushila Devi to face Eva in opening round
264,Ugandan weightlifter who went missing seen wearing old India track jacket
265,We can break toughest defences with good communication: Mandeep
266,"Another blow for Team India: Washington joins Avesh, ruled out of England series"
267,Garlanded Rishabh Pant thanks Ravi Shastri for grand welcome
268,Sri Lanka skipper Dasun Shanaka says on-field bust up was about tactics
269,India's conundrum whether to experiment or not after series win
270,"1st ODI: Dhawan, Kishan star as India thrash Sri Lanka"
271,India tour of England: Indian player tests positive in UK
272,ECB name new squad for ODI series against Pakistan after 3 players test Covid positive
273,1983 World Cup heroes get together on the triumph's 38th anniversary
274,BCCI shifts T20 World Cup from India to UAE
275,"T20 World Cup may have to be shifted to UAE, final call soon: BCCI secretary Jay Shah"
276,New Zealand beat India in World Test Championship final
277,WTC Final: Southee double gives New Zealand hope against India
278,WTC Final: Kyle Jamieson takes five before India hit back
279,WTC Final: Virat Kohli keeps New Zealand at bay on Day 2
280,Bangladesh outclass Zimbabwe in first T20I
281,Australia to play five T20s in a week in short Bangladesh tour
282,Greg Chappell once rejected Deepak Chahar: Prasad
283,When Deepak regretted listing as an allrounder in IPL auctions
284,Virat Kohli has a hit at the nets as Indians play warm-up game
285,Watching Dhoni close out matches has been a big factor: Chahar
286,Umesh leads good bowling display as India bowl out County XI
287,"Dhawan moves up two places to 16th, Kohli second in ODI rankings"
288,Indian contingent ready to rumble in 'Games of Hope'
289,Novak Djokovic knows 'history is on the line' at Tokyo Olympics
290,Deepika Kumari in focus as India look to exorcise past ghosts
291,"Bye for Panghal, 3 others; tough overall draw for Indian boxers at Olympics"
292,Tokyo gold winners to get Rs 75 lakh from Indian Olympic Association
293,Arsenal midfielder Emile Smith Rowe signs long-term contract extension
294,Everton sign English winger Gray from Leverkusen
295,Bengaluru FC sign midfielder Jayesh Rane on three-year deal
296,Sanson Pereira extends contract with FC Goa
297,Manchester City cancel pre-season friendly in France due to quarantine
298,"Made a lot of sacrifices, I want to make them count in Tokyo: PR Sreejesh"
299,FIH postpones inaugural FIH World Hockey 5s to 2022
300,Tokyo Games Indian hockey's best chance to win a medal: Rasquinha
301,Harendra advises Oly-bound players to stay away from social media
302,It's been a journey of self-realisation for the boys: Sreejesh
303,ITF rule change robbed me of my Olympic dream: Divij Sharan
304,"Deemed 'extreme risk' nation, India denied entry into ITF World Junior Finals"
305,"Osaka to play at US Open, 'Big Three' lead men's field"
306,AITA to refer Bopanna's recording act to ethics committee
307,Krejcikova closes in on WTA top 10 after win in Prague
308,Drew McIntyre gears up for the Orton challenge
309,Nikki Cross gears up for her clash with Bayley
310,'Don't have the desire to get back in ring': The Undertaker retires from WWE
311,WWE confirms wrestler has tested positive for COVID-19
312,"Preparing for Daniel is not an easy task, says WWE star AJ Styles"
313,Patriots legend Edelman retires from NFL
314,NFL: San Francisco re-sign Trent Williams to historic six-year deal
315,League prospects seize on few chances to impress ahead of NFL Draft
316,NFL: Tom Brady agrees extension with Buccaneers through 2022
317,"NFL hires first Black female game official, Maia Chaka"
318,DC Players 2021
319,Punjab Kings player list 2021
320,RCB team 2021
321,SRH Players list 2021
322,CSK Players list 2021
323,IPL 2021 Players List
324,IPL 2021 Time Table
325,IPL 2021 Points Table
326,Upcoming Cricket Schedule
327,Cricket Match results
328,MI Players list 2021
329,IPL Schedule 2021
330,Rajasthan Royals team 2021
331,KKR squad 2021
332,WWE Raw results
333,Tennis news
334,Hockey news
335,Football news
336,Cricket Score
337,BCCI
338,Prithvi Shaw
339,Ishan Kishan
340,Robin Uthappa
341,Dinesh Karthik
342,Kedhar Jadhav
343,David Miller
344,Sanju Samson
345,Gautam Gambhir
346,Kieron Pollard
347,Faf Du Plessis
348,Ben Stokes
349,Rashid Khan
350,Sunil Narine
351,Chris Gayle
352,Krunal Pandya
353,Moeen Ali
354,Joe Root
355,Jos Butler
356,Suryakumar Yadav
357,Eion Morgan
358,Glen Maxwell
359,Shubman Gill
360,Andre Russel
361,Steve Smith
362,David Warner
363,Nitish Rana
364,Ravi Shastri
365,Virender Sehwag
366,Chahal
367,Shikhar Dhawan
368,Shardul Thakur
369,Rishabh Pant
370,Parthiv Patel
371,Manish Pandey
372,Mandeep Singh
373,Kedhar Jadhav
374,Karun Nair
375,Hardik Pandya
376,Dhawal Kulakarni
377,Axar Patel
378,Ashish Nehra
379,Amit Mishra
380,Ambati Rayudu
381,Yuvraj Singh
382,W Saha
383,Umesh Yadav
384,Rohit Sharma
385,Mohammed Shami
386,KL Rahul
387,Jasprit Bumrah
388,Ishant Sharma
389,Bhuvneshwar Kumar
390,Ravindra Jadeja
391,R Ashwin
392,Murali Vijay
393,MS Dhoni
394,Pujara
395,Ajinkya Rahane
396,Virat Kohli
397,"Sri Lanka vs India, 3rd ODI: When And Where To Watch Live Streaming, Live Telecast"
398,"England vs India: Rishabh Pant ""Thrilled"" To Be Back With India Squad, Thanks Ravi Shastri For ""Grand Welcome"""
399,"England vs India: After Avesh Khan, Washington Sundar Ruled Out Of England Tests, Says Report"
400,"Sri Lanka vs India: Watching MS Dhoni Close Out Matches Big Factor In Batting Success, Says Deepak Chahar"
401,"Suresh Raina's ""I'm Also Brahmin"" Remark Sparks Major Backlash On Twitter"
402,"England vs India: Rishabh Pant Recovers From COVID-19 Infection, Joins Team India's Bio-Bubble"
403,England vs India: Umesh Yadav Leads Bowling Display As Indians Bowl Out County XI For 220 On Day 2 Of Warm-Up Game
